Title,Location,Asking Price,Cash Flow,Gross Revenue,EBITDA,Established,Inventory,FF&E,Business Description,Location:,"Furniture, Fixtures, & Equipment (FF&E):",Support & Training:
Boba Tea Shop with Franchising possibilities!,"Brenham, TX (Washington County)","$225,000","$71,000","$71,000",N/A,2020,"$5,000","$50,000","We are a Boba Tea Shop! We offer a variety of Boba tea drinks, slushes, and shaved ice. Please check out our website for more information! www.fortunetea.com","Brenham, TX",Included in asking price,Leased,"1,300",2/28/2025,5,Included in asking price,"You will receive a ready to operate Boba tea shop with a trademarked logo and professionally designed website. Our menu and shop was built from scratch with great thought and energy to perfect this business. Our name was created in honor of Robert Fortune. A pioneer of tea. You can watch the documentary here! https://www.amazon.com/gp/video/detail/B07S39WNTL/ref=atv_dp_share_cu_r
 We built this business to compliment our business next door which is a Ba Na Hill Vietnamese Cuisine. www.banahillusa.com We cross promote all our businesses on each website.",We are the only Boba Tea shop in Brenham with a store front sign. There is a Chinese restaurant across the street that offers Boba tea although not on the same scale and floor plan we operate.,We see Brenham as having great growth potential for now and the future. While not in a major metropolitan area we are 1 hour from Houston and 1 1/2 hour from Austin. We also have Blinn Junior College and well known in the area.,60% down payment. Remaining balance paid over the term of the lease with 5% int.,We will train and support you if needed. We are next door so we will always be available in person or by phone.,We have a baby and focusing energies on the family.,http://www.fortunetea.com
N/A,N/A,N/A,N/A,N/A,N/A,N/A,N/A,N/A,N/A
N/A,N/A,N/A,N/A,N/A,N/A,N/A,N/A,N/A,N/A
Highly Cash Flow Restaurant,"Corpus Christi, TX (Nueces County)","$350,000","$300,000","$509,308",N/A,2011,N/A,"$240,000","Step into a unique opportunity that has established a loyal base of customerswith an eclectic menu that gives you the flexibility to introduce new dishes. This restaurant has two dining areas, a full bar and an outside patio that allows you the freedom to create different environments to cater to the varied demographics of the area.","Corpus Christi, TX",Included in asking price,Owned,"4,700",5,Included in asking price,"The owner recently upgraded a lot of the equipment and everything is well maintained. All equipment is owned.

A list of equipment is available on request.","Most areas are oversaturated with restaurants but the number one issue ranked by residents of the area is a lack of dining, shopping, and entertainment choices.","The owner decided to keep reduced hours since government regulations on COVID in 2019 so the restaurant is only open for dinner hours, five days a week. There is tremendous opportunity in opening the restaurant for lunch or even breakfast
since that is underserved in the area. 

There are many more opportunities for growth and the new owners can choose the ones that fit them best. Maybe have the games on at the bar, offer a wider selection of fine wines, provide catering for businesses and events, host private parties.",Multiple financing options are available including long-term SBA financing,The owner is willing to negotiate whatever support and training the new buyers will need. He has been in the business for 41 years and his experience running restaurants in the US and across the world will be a great benefit to the new owners. He has owned this current restaurant for over 11 years and is committed to making sure the new owners succeed.,The current owner has been working for 41 years and is ready to retire and enjoy
Women's & Children's Boutique with Subscription Boxes,"Lubbock, TX (Lubbock County) (Relocatable)","$60,000",N/A,"$107,213",N/A,2018,"$7,091",N/A,"If you love fashion and shopping and want to have a business that allows you can stay home with your children? You might be a great boutique owner! This is a great opportunity to buy an affordable but profitable business with 3 different streams of revenue! You can create your own schedule, have the flexibility you've always wanted, while still earning an income.Total sales 2022: $105,097.69Total sales 2021: $67,488.10","Lubbock, TX",Included in asking price,1,"Custom website
Logo & Branding
Facebook Group for Women's Boutique: 638 Members
Facebook Group for Children's Boutique: 300 members 
Facebook Business page: 3K followers
Instagram for Women's Boutique: 7284 followers
Instagram for Children's Boutique: 119 followers
Email Contacts: 623
Vendor list in order of best selling (Home Based)",Seller requires 50% down and will finance the rest for a negotiated rate.,"Owner is willing to stay on and train for a negotiable rate.

A step by step guide is included for how to run each step of the business so it can be replicated for a seamless transition.",Owner is having a baby.,This business is Home-Based,https://shopkinleyandmal.com
Huntington Learning Center Franchise,"Humble, TX (Harris County)","$99,000","$75,000","$390,000",N/A,2005,N/A,"$65,000","We tutor children in grades K through 12 in reading, phonics, writing, grammar, mathematics and science. We offer individualized one-to-one instruction based on  an our academic evaluation of each child.","Humble, TX",Included in asking price,Leased,"2,200",8/31/2025,15,Included in asking price,"2200 square foot leased space which is ours until August, 2025. There is ample shared parking available for the customers. In January of 2018 we completed a major upgrade of our facility.  This included new carpet and tile, entirely fresh painting according to franchisor’s environmental requirements, and replacement of most furniture.  It is in excellent condition. Pictures of the Center show that its fresh appearance has been maintained. See the attached photographs.","We have a prime location in Kingwood Town Center. It is a vibrant business locality filled with restaurants, banks, doctors, grocery, hardware, pet stores, a library and a small park. Whatever folks are seeking, they can find it here. There are other tutoring services in Kingwood but we offer 1-1 tutoring, compared to their group work. Our teachers are degreed and certified. Huntington Learning Center is the only tutoring business that is accredited as a school by the Western Association of Schools and Colleges. This is fully transferable to a new owner.","COVID-19 had a major impact on all service industries due to closure of indoor spaces for public health concerns. Our industry, which relies on face to face interaction between students and teachers, got hit quite hard. We are recovering. Parents are careful about spending but their commitment to their children's education is bringing them back. Our center has a solid financial performance record during the past 14 pre-COVID years. There are many opportunities for energetic marketing to promote and expand our services to existing and new local schools.",None,"Huntington Corporate (Franchisor) provides thorough initial training to all new franchisees in their systems and procedures. It is followed up by required periodic refresher training. Additionally, seller will be available to provide help and support during the transition period as arranged by mutual agreement.",Retiring. Elderly seller is very motivated and is willing to negotiate the price,This business is an established franchise
Well Established Meat Distributor Business With a Wide Reach,"Euless, TX (Tarrant County)","$1,200,000","$417,411","$4,611,282","$271,478",2018,"$15,000",N/A,"The business was co-founded by the current owner in 2018, after working in the industry for close to a decade. The owner wanted to provide an accessible place for the people of the Dallas-Fort Worth area to buy a quality product, and most importantly, a brand that he and his team could stand by. He didn’t just want to sell meat and collect a check, he wanted to create something bigger than that. With the combination of Dallas-Fort Worth’s need for a local butcher and the owner’s vision for a brand, the business was born. The business is a Texas-based gourmet meat and seafood delivery service. Food is one of the things that people continually come back to. It is resistant to advances in technology and to events that could take a business overnight. The meat market offers a wide range of beef, chicken, seafood, and pork by way of online ordering and home delivery.","Euless, TX",Included in asking price,Leased,"2,500",N/A,43,"Included in the sale are the office furniture, walk-in freezer, a fork lift, and all inventory at the store.","Despite offering top-of-the-line products and services, the business may face competition from local, regional, and national grocery stores. The business differs itself from the competition by providing a level of service and quality that is not found in the grocery stores.",The owner and his team have talked about expansion the past few months and views this as an excellent next step for the business. Places like Houston and West Texas can greatly benefit from the quality of product and service they provide.,The current owner is willing to finance a portion of the transaction.,The current owner is willing to stay on for up to 1 year to help with the transition.,The current owner is looking to move to another state.,https://viabeacon.com/listing/well-established-meat-distributor
Established Greek/Italian Restaurant with Prime Real Estate,"Hardin County, TX","$949,000",N/A,"$435,000",N/A,2019,N/A,N/A,"Welcome to this delicious Gyros, Pasta & Pizza restaurant located in Hardin County, TX, and nestled within prime real estate! This restaurant is dedicated to serving the best quality food in a welcoming atmosphere.They specialize in Greek and Italian cuisine, including fresh and flavorful gyros, salads, wraps, mouth-watering Pasta and Pizzas made with their signature homemade sauce and fresh toppings. They also offer a variety of appetizers, such as hummus and pita bread, as well as desserts such as baklava.The restaurant offers indoor seating for up to 120 guests, with a cozy and comfortable dining area.Located within Prime Real Estate in Hardin County, TX, this restaurant offers a fantastic opportunity for anyone looking to own a successful business in a great location. The real estate includes the restaurant building and land, providing ample parking for guests.The restaurant has a loyal customer base, and great reviews, making it an attractive business opportunity for anyone looking to own a successful restaurant. Whether you are a seasoned restaurateur or just starting, we would love to show you this business and discuss how it could be a perfect fit for you.Don't miss out on the chance to own a thriving Gyro and Pizza Restaurant in Lumberton, TX, with Prime Real Estate included. Contact us today for more information","Hardin County, TX",Included in asking price,Owned,"3,940",4,"Greek Restaurant decor taverna style with tables and booths. Full bar with seating and fully equipped kitchen with quality equipment, Brick oven and walk in Cooler and freezer. Stock room. Office in rear. Bathrooms. Tile flooring.",No other Greek Restaurant in town. Strong customer base. Great reputation. The closest similar style restaurant that competes is more 20 miles away. Market outlook is strong.,"There is plenty of room for growth. 
Even though the Restaurant has a full build out bar, this is a beer & wine only restaurant.  Acquiring a liquor license would increase sales.",Seller offers 2 weeks of support & training to ensure a smooth transition.,Seller is Retiring from the Restaurant business after 20 yrs
San Martino Winery & Vineyards For Sale,"Lavon, TX (Collin County)","$3,150,000","$150,000","$600,000",N/A,2003,"$150,000*","$600,000","Thisfamily-owned winery specializing in handcrafted wines using modern techniques but with a traditional “soul” borne in the legacy of a winemaking family that has crafted wonderful wines for over 600 years in northern Spain. Perseverance, hard work, vision, and passion are the elements that created San Martiño Winery & Vineyards in 2003 in North Texas, just outside of the city of Rockwall.Over the years the winery has expanded and grown, became modernized and won extensive awards not only in Texas but also in international competitions such as San Francisco, Los Angeles and others. But the soul of San Martiño Winery & Vineyards is not the modern and beautiful facilities, but in the sweat, energy and time that everyone involved with our winery has invested over the years. Every bottle of wine contains not only a precious liquid for you to enjoy, but it also contains our time, our efforts, our friends unselfish dedication to our success, the aches and pains of many overworked backs and the laugh and enjoyment of the post production and bottling gatherings. Our name is on each bottle and our story and dreams are inside of it.","Lavon, TX",Not included in asking price,Owned,"9,600",2,Included in asking price,"Main building (tasting room, barrel area and upstairs apartment (3500 sqf), Event Center (appr 2500 sqf), Production Building (2400 sqf), Cold Storage building (1200 sqf), One large patio covered (900 sqf) one medium cover patio (appr 600 sqf), One storage building (150 sqf)",Established winery and tasting room with a robust two tiered wine club of approx. 880 members. The owners club is at 135 members and the original club is approx. 745 members. The wine is distributed to the tasting room and wine club members. No outside distribution currently.,Owners can discuss training and support upon negotiation of an LOI.,Owners are getting older and would like to travel more.,https://www.sanmartinowinery.com/
High Revenue Construction Management Services Business,"Houston, TX (Harris County)",N/A,"$1,555,820","$8,571,476","$657,892",2017,N/A,N/A,"The business was originally started in 2017 by the owner. Since its inception, the business has grown tremendously year over year, with the owner’s 20+ year experience guiding the ship. The company offers a wide range of construction offers and services to meet the specific needs of each customer and project. They offer Construction Management, Property Preservation/Home Rehab, and Maintenance Services.With the business’s abilities and connections, they are able to work on a high volume of construction jobs, while offering maintenance on the side. The business is as a reliable and trustworthy provider and is widely considered a go-to resource for property mangers and investors seeking these services.","Houston, TX",Included in asking price,Leased,N/A,N/A,22,"The current owner has recently signed a new lease for better office spaces, which will provide room for growth, improve the placement for customers, and enhance the overall workflow of the business.","The business faces competition from companies who service tech-powered renovations, turns, and maintenance at scale. The business separates itself from its competition by building relationships with their clientele, and knowing the right service to provide. Their specialization in rehab, construction, and maintenance sets them apart from more than your average private home business. Additionally, they are able to offer a wide range of services to meet the specific needs of each customer.","Although most growth opportunities are currently being pursued by the current owner, there are still some avenues for further growth for the business. A potential area for growth is the optimization of digital and traditional marketing. By leveraging social media advertising and Google search engine optimization (SEO), a new owner could attract more clients. Additionally, the business could pursue more aggressive marketing strategies on their website to increase their online presence.",The current owner is willing to finance a portion of the transaction.,The current owner is willing to stay on for between 9 and 12 months to help with the transition.,The owner is ready to move on to other ventures.,https://viabeacon.com/listing/high-revenue-construction-management-services
Physical Therapy Practice for Sale,"Fort Bend County, TX","$740,000",N/A,"$183,000",N/A,2019,"$13,833",N/A,"5-star rated physical therapy clinic based in Missouri City, just outside of Houston, Texas. The clinic specializes in helping patients reduce pain, gain strength and partnering in the rehab journey. Patients are treated for a variety of injuries both chronic and acute while working toward the common goal of recovering their quality of life.","Fort Bend County, TX",Included in asking price,Leased,"1,650",3/7/2024,4,"There are many available assts that are included in the sale. They include the building which is a convenient 1, 650 sqft with a bathroom, two rooms for patient care and back office break room. It has a an open floor plan with a privacy wall to separate the front desk entrance from patient care. Items included in this sale include but are not limited to: administration desks, total gym, therabands and bosu balls, free weights, treadmill, exercise bike, two high low tables, manual massage chair, two plinths and more.",The current market condition based on The U.S. occupational and physical therapy services market is a projected growth of $50.26 billion to  $72.70 billion by 2029. The trajectory for this market is stable that is marked with growth due to the consistent and increased demand for physical therapy services. Chronic pain among the increasing geriatric population has enabled the increase of demand for PT services. The largest competitor is a larger chain that has several locations opposed to being a single outpatient clinic.,"The expansion possibilities are endless due to the clinics 5.0 rating, patient following, community referral partners, marketing plan, products offered within the clinic and strong relationship with vendor for clinic products. The business could continue in the path of growth by adding the following services for continued growth: Massage, yoga, pelvic therapy and specialized therapy for pregnant and post partum women.",The buyer will receive personal training if needed from the owner who is Doctor in Physical Therapy. Training included will be limited to a maximum one month or until training is no longer needed and/or available to owner.,Owners would like to pursue an existing business venture.,This business is an established franchise
ESA NASA Houston TX,N/A,N/A,N/A,N/A,N/A,N/A,N/A,N/A,N/A
Established Patio Company,"College Station, TX (Brazos County)","$265,000","$65,000","$600,000",N/A,2014,"$5,000*","$35,000","Patio construction company, that specializes in the construction of outdoor living areas, such as pergolas, patio cover, outdoor kitchens, porches, screened in porches, flagstone patios etc. The company also has a same retail side that sales different patio accessories, patio furniture, grills, heaters, etc. business has showroom where different construction and retail products are displayed. The business has been in operation for over 9 years. Has an established customer base.","College Station, TX",Not included in asking price,Leased,"1,800",N/A,2,Included in asking price,There are three offices with a showroom with multiple displays. Mens and Womens restrooms. Connected to the showroom/offices there is a warehouse with roll up doors.  A kitchenette for employees. Three outdoor displays connected to the building.,The seems to be very steady.,"The business has a large growth potential. With the growth of Bryan/College Station and surrounding areas, this business could grow rapidly with in a couple years.",Down payment and 3 years at 5.5%,Seller with will be available for support for the first 6 months.,Seller is selling because they have another business that just takes up too much
Successful Roofing Business For Sale,"Bastrop, TX (Bastrop County)","$1,200,000",N/A,"$1,500,000",N/A,2008,N/A,"$20,000","Highly successful Residential and Commercial Roofing Business incorporated in 2008.  Recently voted #1 by consumers in the local area.  Owens Corning and GAF preferred contractor offering roofing, siding, repairs, inspections and  roof coatings. Thriving Business territory is a 60 mile radius area  metropolitan Austin and surrounding communities.We have completed over 2,500 minor to major transactions since 2008.We are experienced in composite, metal, TPO, EPDM, modified bitumen, gutters, siding, painting.","Bastrop, TX",Included in asking price,Leased,N/A,11/22/2001,3,Included in asking price,"1 large office & 1 small office.
7 office chairs, 3 desks, three file cabinets, 3 computers, refrigerator, microwave, coffee maker, printer, armoire, etc.",Market is really good now. I do not have much in the way of competition. Area is booming.,"Nothing but pros for growth or expansions. They're are some empty offices in this complex.
I am the only person handling customers after intake. With younger more aggressive team here, there so much room to pick up more customers. I have a great client base. We do a lot of repeat and referral business.",80% Down,"I can share my knowledge of the business, measuring, roofing, insurance claims, forms of all types. 
I would be willing to stay on as advisor for 6 months.",Retiring
Beautiful Medical Clinic in Frisco TX,"Frisco, TX (Collin County)","$350,000","$150,000","$600,000",N/A,2022,"$20,000","$130,000","High end, beautifully decorated Medical Clinic with about 3,800 patients.  We offer Hormone Replacement Therapy, Ultrasound, Thermography and Lab services.  Located at the heart of Frisco TX, near the intersection of Legacy and Eldorado, and the Dallas Tollway.","Frisco, TX",Included in asking price,Leased,"1,426",10/31/2024,12,Included in asking price,All furniture and medical equipment is included,3 hours/day for 2 weeks maximum,Moving abroad
Established Juicery and Health Foods Market for Sale,"Dallas, TX (Dallas County)","$500,000","$166,030","$931,533","$214,842",2012,"$250,000",N/A,"The business was originally founded in 2012 by the owner as an online store specializing in the sale of health-oriented juices and foods. Prior to creating the business, the owner worked in finance, but eventually became burned out in the field. He had the idea for a juicery and health food business after spending a few months traveling and learning more about the myriad health benefits of juice cleanses.In 2013, the owner decided to expand the business by opening the first location in Georgia, serving smoothies, juices, health foods and snacks. Most recently, the owner opened another store in Texas in mid-2021.Although COVID-19 presented a minor setback to the business, the owner has since rebounded and is beating it's previous revenue goals. The business has two locations in Texas available to sell. The locations are fully staffed and operated by an in-person General Manager, the owner is fully remote and spends less than 2 hours per month working on the business.","Dallas, TX",Included in asking price,Leased,N/A,N/A,18,"The business conducts business out of their two retail locations based in Texas. Each of these locations has a commercial kitchen used for juice and food preparation, and are located in high-income areas in Dallas. Both locations also have great parking, allowing for customers to easily travel and access the stores. The owner is open to transferring the existing leases or assisting the buyer in securing favorable, long-term leases at all three locations.","The owner has separate competitors for each of their business segments, specifically between their online and retail marketplaces. For the business’ physical retail spaces, their competitors include The GEM, which is a natural juicery based in Dallas, and Juiceland, which is a chain of juiceries around the country. For their online store, the business's main competition is Amazon, where there is a large selection of healthy snacks and foods.","The business has several avenues for growth, including optimization of digital and traditional marketing, and expanding their current service offerings. For optimization of digital marketing, a new owner could leverage social media advertising and Google Search Engine Optimization (SEO) in order to gain more clients.

The business could also achieve further growth by focusing more on their online sales channel. Currently, this channel only accounts for less than 3% of the business’ overall revenue, even though it is a quick and high-margin channel.",Seller is looking for a cash deal,"The owner is willing to help introduce the buyer to key employees, main suppliers, and the inner workings of the juice and natural foods industry.",The current owner is looking to move to Montana and focus on new ventures.
