Title,Location,Asking Price,Cash Flow,Gross Revenue,EBITDA,Established,Inventory,FF&E,Business Description,Location:,"Furniture, Fixtures, & Equipment (FF&E):",Support & Training:
TX Drinking Water Delivery Service; $3M SDE - UNDER CONTRACT,"Midland County, TX","$17,997,000","$3,000,000","$6,500,000","$3,000,000",1997,N/A,"$5,000,000","The company has provided state licensed potable water to residential and commercial customers throughout West Texas for 25+ years. They have built a reputation as a reliable source of high-quality potable Drinking Water and processed R/O Drinking Water providing unbeatable customer service 24/7, 365 days a year in Texas.DEAL HIGHLIGHTS:Supply / Demand Risk: There is low risk to the business model since quality potable water is scarce in West Texas. There is no risk from supply chain disruptions as the redundant inventory sources are owned by the company and not from a third-party seller.Growth: There is an opportunity to acquire even more land (5.4 additional acres), which would allow for two more wells. This would result in another 230,000 gallons of potable water production per day.Marketing: The company has never invested in sales or marketing, and believes the application of marketing expertise could grow the company exponentially.","Midland County, TX",Included in asking price,Seller will provide effective training and knowledge transfer to the Buyer in all matters relating to Company operations during an agreed-upon transition period.
Established Health & Safety Consulting Company,"Midland County, TX (Relocatable)","$700,000",N/A,"$244,844","$180,972",1997,N/A,N/A,Health & Safety Consulting Company is a safety and health consultation service business based in West Texas. The company assists businesses meeting workplace safety requirements and regulations. The company has been assisting small to medium sized business complying with the myriad Health & Safety requirements for the Oil and Gas industry for over 25 years. The company has an extremely broad client base with multiple growth opportunities for a buyer due to every contractor in the Oil & Gas industry having to comply with the Health & Safety requirements to obtain a Master Service Agreement.,"Midland County, TX",Included in asking price,1,Home-based business with 452 sq.ft dedicated to business use with two separate offices. 360 sq.ft of outside storage dedicated to company-owned equipment. (Home Based),Strong customer base and is an established business in the Health and Safety field.,SBA pre-qualified by several lenders,The seller is flexible in providing up to 6 months transition.,Ownership retiring from the business,This business is Home-Based
"Printing, Large Format, Signs, Marketing Biz  - High Vol.","Fort Worth, TX (Tarrant County)","$650,000","$283,314",N/A,N/A,1971,N/A,N/A,"This is a rare opportunity to buy a long-established, high-income business in Ft Worth. The business provides print, marketing and design solutions. The business is seeing a huge sales increase in 2022 over 2021. No experience is necessary. The owner spends their time on managing and marketing the business.This is an essential business with multiple revenue streams, normal business hours, low inventory & overhead but most importantly EVERY business is a potential customer.Minuteman Press is a complete marketing service provider that has helped businesses grow for over 50 years. We’ve developed a unique business model that provides products and services that businesses need for their everyday operations, in addition to their marketing and advertising efforts. Prior experience is not needed to own and operate a Minuteman Press franchise. Our owners are business people that are alert to the needs of their local business community and can enjoy a long-term repeat relationship with their clients by providing exceptional quality and service.Business features:Substantial compensation to the ownerExcellent reputation for quality & serviceProfessional staffNormal business hoursMultiple revenue streamsHigh demand products & servicesThis is an established independent business. As part of Minuteman Press' conversion program we assist independent print centers that are looking to secure an exit strategy. This center has met our requirements and fits our business model. This is a great opportunity for an individual that wishes to join a #1 rated franchise but prefers to start with an established business that has an active customer base.All financial information above has been provided by the owner of this location and/or the owner’s financial advisors and has not been verified by Minuteman Press International. We make no warranty regarding the accuracy of this information and advise prospective buyers to conduct their own due diligence prior to purchasing a location.","Fort Worth, TX",5,Owner financing is available to a qualified buyer,No prior industry experience is required. There will be a detailed two week training program. There will then be training onsite and continued local support. There is a qualified staff in place to handle the production work. The owner focuses their efforts on the marketing and management aspects of the business.,Owner is retiring
Established and Thriving High-End Tropical Dessert Franchise,"New Braunfels, TX (Comal County)","$849,000",N/A,N/A,N/A,2016,N/A,N/A,"Bahama Buck's is the premier tropical dessert destination for shaved ice, smoothies, acai bowls and tropical drinks. The New Braunfels location is well established and is consistently in the top 20 performing stores of the entire franchise. Location is on a major thoroughfare and is on an end-cap with a wide drive-thru lane.Located in a prime area of New Braunfels, the store is only minutes from both area high schools and several elementary and middle schools for the regular after-school guests. During the Spring and Summer this location benefits from the booming tourist industry, being less than 2 miles from both the destination of Gruene and the world-famous Schlitterbahn Waterpark. Business assets include a state-of-the-art 3 year old Event Trailer, fully equipped to serve our products at corporate events, fairs, festivals, food truck parks etc. This trailer provides the opportunity for additional revenue year-round. Unlike other dessert shops, Bahama Buck's is a place that brings families and friends together to enjoy the ultimate tropical dessert experience in a fun, flavorful atmosphere. Because of our unique brand, we are busy all year long - not just when the weather is hot! Bahama Buck's Franchise support is top-notch and provides all the resources needed to be successful and profitable.","New Braunfels, TX",Leased,"2,300",8/1/2027,22,Assets include all FFE plus a 2018 18' Event Trailer fully equipped for off-site events.,"Excellent market, located in a prime area of town and one of the fastest-growing counties in the country. No true apples-to-apples competition for shaved ice, smoothies or acai bowls exist within the city. There are other ""snow-cone"" places but they are all trailers parked somewhere seasonally. There is a smoothie shop about 5 miles away but nothing that offers the variety of tropical desserts that we do.","Additional franchise markets are available for future expansion. Sales will continue to increase with the growth of the city. Bahama Buck's Franchise Corporation is always adding innovative products to the menu that increase sales, revenue and drive the brand. There is unlimited opportunity with the Event Trailer - especially with corporate or special events commanding an average of $1000 per engagement. We have established relationships with many local organizations and companies to bring our trailer to special events throughout the year.","Bahama Buck's Franchise Support Center provides all training and resources needed to operate the business. Current owners will be available for an agreed upon transition period for support, resources and training.",Retirement,This business is an established franchise
SBA Pre-Qualified - Machine Shop (Oilfield Manufacturing) Company,"Ector County, TX (Relocatable)",N/A,"$1,494,738","$3,655,996","$1,404,738",2016,N/A,"$1,475,927","Machine Shop Company serves the oilfield of Southeastern New Mexico & West Texas since 2016. The Machine Shop has over 50 years of combined experience in machining and repair downhole tools, drill bits, BHA, tubing strings, and fishing tools. Machine Shop Company has a specific process to meet turnaround times while still achieving quality work.","Ector County, TX",Included in asking price,Leased,N/A,6/23/2026,14,Included in asking price,"9,800 sq.ft. facility (8,000 sq.ft. shop and 1,800 sq.ft office), on 3 acres of land.",Profitable Company with a strong management team in place. The Company will continue to grow and expand into the future and will continue to diversify with a strong customer base.,This business is SBA pre-qualified by several lenders,The seller is flexible in providing a 3–6 months transition period or stay for a longer period on a consulting basis.,Ownership retiring from the business
Price Reduced  |  Two Large Laundromats  |  Newly Renovated,"Pasadena, TX (Harris County)","$1,600,000","$410,000","$900,000",N/A,1990,"$50,000*","$3,000,000","**A website has been created for this business (www.wash4sale.com) with video tours & interviews with the owner.**** Please sign the NDA & Buyer Profile on our website before contacting us (www.wash4sale.com).**Two large laundromats for sale together or separate.  Well-established locations, in business for over 30 years, with great demographics & visibility.  Recently renovated with new machines in 2021 & 2022.  The owner is selling in order to focus on his other business, which is much bigger.  The laundromats under-performed in 2021/22, but he has turned it around over the last 6 months.  The owner is selling for less than he invested (purchase + renovations), so this is an excellent investment for a buyer that has the time to focus on the business.  There is a trustworthy staff in-place with an excellent Manager overseeing both stores.  The new owner can run semi-absentee or eliminate the Manager and run it for more cashflow.  Location #1 (I-10 & Federal)- REDUCED PRICE:  $895K (31% price drop) - Original Price $1.3M | Cashflow: $250K (5.2x multiple) - Currently under contract, but taking back-up offers - Invested $1.4M (purchase + renovations) - Pre-approved for financing from Eastern Funding - Large store.  6,000 sq. ft. - Renovated in 2021: new machines, electrical, ACs, floors, counters, paint - 52 Washers – 20lb to 100lb (several huge washers)- 58 Dryers – 30lb to 100lb (several huge dryers)- Large service counter with product display case- Large parking lot - Surrounded by apartments- Excellent staff (5+ years)- Digital POS system that manages inventory Location #2 (Pasadena)- REDUCED PRICE: $695K (31% price drop) - Price $1.0M | Cashflow: $160K (6.25x EBIT/Cashflow) - Invested $1.5M (purchase + renovations) - Pre-approved for financing from Eastern Funding - Huge store. 8,000 sq. ft. - Renovated in 2022: new machines, electrical, bathrooms, floors, counters, paint- 88 Washers – 20lb to 100lb (several huge washers)- 78 Dryers – 30lb to 100lb (several huge dryers)- Large counter with product display case- Large parking lot, two entrances- Excellent staff that’s been in-place 10+ years- Digital POS system that manages inventory","Pasadena, TX",Not included in asking price,Leased,"15,000",12/31/2039,7,Included in asking price,"These are two large locations.  Both have recently been renovated (2021 & 2022).  

Location #1 (I-10/Federal)
Large store.  6,000 sq. ft.
Renovated 2021: new machines, electrical, bathrooms, floors, counters, paint.
52 Washers (20lb to 100lb).
58 Dryers (30lb to 100lb).
Large service counter with product display case.

Location #2 (Pasadena).
Huge store. 8,000 sq. ft.
Renovated 2022: new machines, electrical, bathrooms, floors, counters, paint.
88 Washers: 20lb to 100lb.
78 Dryers: 30lb to 100lb.
Large service counter & display case (soaps).","There are other laundromats in the area, which is normal & a good sign.  There is plenty of business for everyone.  It shows a healthy market.","We have been running Google Ads & seen great results.  The analytics show that about 100 people per month are clicking the ""map to store"" to get directions.  This correlates to increasing profits.  So as we get customers in the store, we are keeping them.  

Additionally, we recommend finding commercial customers (restaurants, gyms, etc).  We are in the process of doing this now.",Both locations have been pre-approved for financing from a reputable lender.,"We will provide training & support for four weeks.  If more training is required, we're happy to assist.  The goal is to ensure you are successful.",Focus on our other business that is 15x bigger.,https://www.wash4sale.com
Fantastic Opportunity to Own a Franchise Locksmith Business,"San Antonio, TX (Bexar County)","$95,000","$50,000","$459,000",N/A,2016,"$8,000*","$5,000","We pride ourselves in being Physical Security Specialists.  This is part of a national franchise with 95+ locations across the USA.  The family business has been in operation since 1946. Our technicians don’t just rekey and install locks—they’ll also install door hardware, new doors & frames, intercoms, access control, camera systems, thermal readers and other high-tech equipment.  We stay up to date with the latest technology that businesses and homes need to stay protected.  90% of our business is commercial.  10% Residential.","San Antonio, TX",Not included in asking price,Leased,N/A,12/30/2022,3,Included in asking price,"We rent the space from month to month.  We are a mobile business.  Everything will transfer:  Vans, Tools, Inventory","Market conditions are good for this type of business.  Everything is going towards access control, digital locks and other security technologies.","Huge growth potential!!  San Antonio has seen the job market increase by 1.6% over the last year. Future job growth over the next ten years is predicted to be 39.6%, which is higher than the US average.  The population of the San Antonio metro area is expected to top four million people by 2050.  
The Territory Coverage is all of San Antonio..",Buyer must have about $100K in liquid assets in addition to the sales price.,You have a huge infasturcture to support you.  There is an admin person currently.  Will  help with the transition.,Health Issues.  Selling below cost for quick sale.,http://www.flyinglocksmiths.com
Established e-com WHOLESALE business (AMZ),"Dallas County, TX","$41,345","$3,200",N/A,N/A,2020,N/A,N/A,I hired a company to run an store for me and have been very satisfied with the performance but it looks like its time for me to deploy my capital into another business. This is very hands off and almost no work to maintain. The company that runs it is similar to an airbnb management company in the sense that they most of the work and you simply use your credit lines to help scale this Amazon store.,"Dallas County, TX",3,This business uses the prep center shown in the picture to ship all inventory so that you can be located anywhere in the world to run this business. (Home Based),N/A - There is really nothing out there like this!,With access to large credit lines or cashflow you can grow this business extremely big.,All training and support is provided by the team. They basically hold your hand during this process,"Looking for something more hands on, and I need capital to buy a new business.",This business is Home-Based
Great Body Shop For Sale,"Harris County, TX","$4,000,000","$350,000","$2,500,000",N/A,2014,N/A,N/A,Busy Body Shop on the east side of Harris County. It is on a main street in the city and sits on 4 acres. Much more can be revealed with a qualified buyer.,"Harris County, TX",Included in asking price,Owned,"10,000",15,"Located on 4 acres on one of the Main Street in the City. On the property is two buildings. One is around 10,000 square feet and the other is around 2,500 square feet. All the equipment you need to operated the shop. Comes with two paint booths. Pad already poured it you want to add another building. Much more can be revealed to a qualified buyer.",There are a few other body shops in the area.,With an owner operator business would be able to grow more. I am not able to be there but just a few hours a week.,may can assume a sba note,I can provide the training that is needed and some ideas that would make the place more profitable.,i have another business that requires my time and dont have the time to spend at
Cash Positive Hair Salon,"San Antonio, TX (Bexar County)","$105,000",N/A,"$190,700",N/A,2021,"$2,000*",N/A,"Fantastic Sams Holding Corp. is an American chain of full services hair-care salons in the U.S. and Canada. With over 900 franchised locations, it was the first nationally franchised unisex salon chain in the U.S. and it is one of the largest salon chains in the U.S. Fantastic Sams was founded in 1974 by Sam Ross in Memphis, Tennessee.Franchising began in 1976, under the title ""Incredible Sam's"" but was changed in 1981 to ""Fantastic Sams"" so that it was easier to say. Fantastic Sams salons also sell Fantastic Sams hair-care products.","San Antonio, TX",Not included in asking price,Leased,"1,350",5/5/2025,4,"Sustainable Customer Base
Salon Furniture (Home Based)","This model is very easy to scale. 

PRICE is UNDER CURRENT Value.

Purchase of this business requires the purchase of 2 additional licenses for expansion purposes.","Local Training Center
Marketing & Advertising
Recruiting Assistance
Management Assistance",Looking at Expanding in other areas.,This business is Home-Based,This business is an established franchise,https://www.fantasticsams.com
Great Weatherford Pool Route,"Weatherford, TX (Parker County)","$120,060","$117,358","$138,069",N/A,2021,N/A,N/A,"Here’s your chance to own a great pool route in Weatherford, TX! The route consists of 56 residential accounts generating a monthly income of $10,005.00 plus additional income from repairs and filter cleans!More information:What is a pool route? It’s a group of accounts being sold by a pool company. Typically it’s being sold to fund other ventures or as part of a retirement plan.Why are pool routes better than buying a traditional business? If you compare incomes vs asking prices it’s very clear. A route generating $50,000 per year will sell for roughly $50,000. A traditional business making the same income would cost $100,000 or more to purchase. There are other great benefits as well. Give us a call to learn more.At Sealey Business Brokers we want you to get started off on the right path to success, so we can include our very own Quick Start Program and get 30% off QuickBooks by signing up with Bookkeeping 101! Also included with every route is our free consultation to share our almost 10 years of experience in the swimming pool industry.","Weatherford, TX",0,Unlimited potential to expand,60% down and finance 40% over 24 months at 7% interest,Seller will provide 30 days of training to ensure a smooth transition.,Other interests
Austin/SA Cash Flowing Powerful National Insulation Franchise Brand!,"San Antonio, TX (Bexar County) (Relocatable)","$499,000","$125,000","$600,000",N/A,N/A,N/A,"$350,000","Insulation aranenise ke-sale unth Inston cash Mom! This established and turnkey National Franchise re-sale is all set up and ready or a new owner and features $100k+ Net Cash Flow! **4 Prime Texas Territories convey with the sale and allows you massive rooms for growth and profits!**This existing business is fully stocked and staffed and ready for a new owner to build and the already impressive sales! Take advantage of the terrain in the Texas housing boom as Everyone is Moving to Texas! Constant moisture, new home construction and natural disasters call for a constant need for this business. It’s literally built-in year-round business!Plus, the Green Carbon footprint lets consumers take federal tax credits for replacing their home or business insulation with new Green insulation!**Did we mention NATIONAL Accounts with HOME DEPOT & LOWE’S?Highlights:• Approximately $350k+ in hard equipment depreciated assets.• Approximately $600k Sales in first year!*Sales Trending Up for 2023• $100k+ NET CASH FLOW/SDE• Full National Franchise Support, Training and Marketing• BOOMING INDUSTRY- $60 Billion Dollar Industry*Optional 2500 sq ft storage facility at $2500 per month• SIMPLE - Few Employees, Flexible Hours• INVESTMENT - Low CAPEX, Depreciable Equipment• HIGH REVENUE – Strong Average Ticket• SUPPORT - Proven Marketing, Proven• Sales Process, Recruiting Assistance, & National Partnerships• Build on the already impressive sales.Too Many Positives to List Here!Price $529k","San Antonio, TX",Included in asking price,Home Based,Full and Ongoing Franchise Support and Training,Personal,This business is Home-Based,This business is an established franchise
Established Pizzeria open 20 years with annual sales of up to $720k,"Houston, TX (Harris County)","$500,000","$130,000","$720,000",N/A,1991,"$5,000","$40,000","This 2000 sf full-service Pizzeria located in the dynamic midtown area serves a full menu of Italian classics.  The restaurant offers online ordering, local delivery and dine in service.  The late-night weekend crowd relies on this restaurant to provide quality food after the bars close.  The location had a liquor license for several years and this license can be renewed.  The long-time staff includes multiple seasoned cooks and a full-time on-site manager.  Sales declined due to the pandemic and the owner's health but are recovering.  A dedicated owner operator should be able to return the restaurant to the pre-pandemic annual sales numbers which exceeded $720,000.  Assuming an industry standard 18% bottom line profit, this sales amount would generate owners' discretionary income of approximately $130k.  Perfect opportunity for foreign national seeking US business visa.  PLEASE NOTE THAT THE FINANCIAL PROJECTIONS ARE BASED PRE-PANDEMIC PERFORMANCE AND ARE NOT REFLECTIVE OF CURRENT SALES OR MARGINS.","Houston, TX",Included in asking price,Leased,"2,000",N/A,10,Included in asking price,"2000 sf restaurant and kitchen space.  All necessary restaurant equipment is fully functional, in good shape and currently in daily use.  Tables and chairs are of good quality.  Fresh paint, ceiling, flooring and lighting.  New POS system.  All recipes, trade names, websites, etc. transfer to the new owner.","Sales can be improved dramatically through increased internet marketing, local coupons and catering.",Liquor license was allowed to expire during COVID due to bar closures in the Houston market.  The restaurant previously offered wine and beer.  Happy hour and an expanded lunch special menu would provide additional sales.,SBA or conventional financing,Business manager will provide ongoing accounting and tax support to new owner as desired.,Owner has recently developed a chronic health care situation resulting in his in
Cash Flow | Beach Front Quality Inn & Suites,N/A,N/A,N/A,N/A,N/A,N/A,N/A,N/A,N/A
REDUCED Official Toy Store of the Dallas Mavericks,"Denton County, TX","$100,000","$50,000","$512,000",N/A,2020,"$40,000","$20,000",The Award Winning collectible toy store and official toy store of the Dallas Mavericks Basketball Team,"Denton County, TX",Included in asking price,Leased,"5,000",12/31/2023,4,Included in asking price,"Sale is for three stores located in Denton. Access to proprietary procedures and access to accounts to purchase collectibles at wholesale costs. Access to celebrity talent for in store appearances and backing from the Dallas Mavericks basketball team. IP rights to the Fanboys brand, with approval. Rights to open additional Fanboys franchises, also with approval.",Demand for collectibles is growing daily,Establishing different Fanboys stores worldwide,Stores are fully staffed but 5 days training will be provided,To only run the corporation of Fanboys,This business is an established franchise,https://fanboysmarketplace.com
Rosemary's Vineyard and Winery,"La Grange, TX (Fayette County)","$1,100,000",N/A,N/A,N/A,2000,N/A,N/A,With a profitable business this 10 acre property has the infrastructure and plants to accommodate 1.5 acres of vineyard and has a 3000sf tasting room with a production area in the warehouse.There is an approx. 1750 sf house on the property this is keep in very good condition. This 3 bed 2 bath can be a perfect homestead or a nice b&b for someone that is looking to rent out the home.,"La Grange, TX",Owned,"4,750",2,Storage building with tasting room. Vineyard with infrastructure and equipment.,Owners are elderly and want to retire
