Title,Location,Asking Price,Cash Flow,Gross Revenue,EBITDA,Established,Inventory,FF&E,Business Description,Location:,"Furniture, Fixtures, & Equipment (FF&E):",Support & Training:
Pest Control and Extermination Business for Sale,"Houston, TX (Harris County)","$450,000","$123,345","$593,841",N/A,1977,"$15,000","$100,000","The business provides a comprehensive range of pest management services, including general pest control, bed bug extermination, termite inspection and treatment, rodent and wildlife management, as well as insect control. With a talented and dedicated team in place, a solid customer base, and essential assets such as a fleet of vehicles, this business is ready for continued success under new ownership. The business presents a valuable opportunity for an owner-operator within the pest control industry or a strategic buyer looking to expand their geographic footprint. The business is a turn-key operation with a proven track record of delivering top-notch services to both residential and commercial properties.","Houston, TX",Included in asking price,Owned,"1,280",8,Included in asking price,"The business operations are housed in a commodious 1,280 square foot office building, situated on a 7,632 square foot lot, with an adjacent 9,540 square foot lot for potential expansion. The office space has been thoughtfully designed to cater to the needs of the business, featuring a variety of offices to accommodate employees, a kitchenette, and bathroom. Furthermore, the establishment’s close proximity to major highways offers convenient transportation accessibility, making it a desirable location for both employees and clients.","The Texas region presents a crowded landscape for pest control services with approximately 700 firms in operation. What sets this business apart are it's 4+ decades in business and robust, loyal customer base. In the pest control industry, having a large recurring customer base leads to strong profitability.","The business is poised for growth through the introduction of an expanded range of services, including mosquito control, lawn treatments, cleaning services, pool services, and tree services. This diversification of offerings will present a unique advantage for the company, enabling them to attract a broader client base seeking convenient access to a full suite of services from a single provider. In addition, a new owner would see considerable returns on investment into CRMs, project management and HR software.",The current owner is willing to finance a portion (10%) of the transaction.,The current owners are willing to stay on for up to 6 months to help with the transition.,"After successfully operating and growing, the owners are looking to travel."
Established Door Retailer and Installation Business for Sale,"Spring, TX (Harris County)","$350,000","$149,265","$1,218,485","$14,702",2017,"$15,000",N/A,"The business, founded at the beginning of 2017, is a full-service door store that specializes in the sales and installation of residential, exterior doors. They sell iron, wood and fiberglass doors primarily to existing home owners. The business as a beautiful showroom, a 4.9 star Google rating and outstanding installation contractors and staff.The business has established itself as a go-to resource for customers in need of door sales and installation services, and has built a reputation as a reliable and trusted provider. The business is an ideal acquisition for a buyer looking to grow an already established, top-rated service business in the heart of the northern Houston suburbs.","Spring, TX",Included in asking price,Leased,"1,771",6/30/2026,7,"The company conducts business out of a 1,771-square facility that serves as both a showroom and office space. The facility is divided into several different areas, including a showroom where customers can browse a variety of door options, as well as an office where staff can conduct business and meet with customers. The facility also has a storage area in a next door unit where the business keeps its inventory of doors and supplies.","The business’s main competitors are other smaller, Texas-based door sales and installation businesses. Other big box retail stores offer similar products, but lack the level of specialization.

What sets the business apart from its competitors is its high-quality showroom that showcases a wide range of door options for customers to browse and consider. This can help customers visualize the different styles and finishes available and make informed decisions about which doors are best for their needs.","The business is still establishing its presence in the great Houston, Texas area. There is potential to expand beyond the northern suburbs and open additional physical locations in different parts of the region. This may require some additional investment in real estate and hiring new employees, but it can be an effective way to reach new customers and increase sales. Additionally, the business could consider partnering with other companies, organizations, and contractors that already have a presence in these areas.",The current owner is willing to finance a portion of the transaction.,"The owner is willing to stay on for an extended period to help introduce the buyer to key clientele, employees, and the inner workings of the business.",The owner is looking to transition into the home remodeling industry.,https://viabeacon.com/listing/door-retailer-and-installation-business
Great Boerne Pool Route Franchise,"Boerne, TX (Kendall County)","$72,000","$48,093","$113,116",N/A,2018,N/A,N/A,"Here’s your chance to own a great pool route franchise in Boerne, TX! The route consists of 40 residential accounts generating a monthly income of $8,200.00 plus additional income from repairs and filter cleans with 1 amazing Full-Time Employee included! Franchisor will need to approve the buyer.Although this route isn’t advertised as offering owner financing, if you have 60% to put down we can present it to the owner to see if they want to carry the remaining 40%. Serious buyers only.More information:What is a pool route? It’s a group of accounts being sold by a pool company. Typically it’s being sold to fund other ventures or as part of a retirement plan.Why are pool routes better than buying a traditional business? If you compare incomes vs asking prices it’s very clear. A route generating $50,000 per year will sell for roughly $50,000. A traditional business making the same income would cost $100,000 or more to purchase. There are other great benefits as well. Give us a call to learn more.At Sealey Business Brokers we want you to get started off on the right path to success, so we can include our very own Quick Start Program and get 30% off QuickBooks by signing up with Bookkeeping 101! Also included with every route is our free consultation to share our almost 10 years of experience in the swimming pool industry.","Boerne, TX",1,Unlimited potential to expand,Seller will provide 30 days of training to ensure a smooth transition.,Relocating
Executive Model Temp Wall Franchise featuring Residual Income!,"Tarrant County, TX (Relocatable)","$165,000","$150,000","$520,000",N/A,2017,N/A,N/A,"Hospitals LOVE US! Why? We are a FULL-SERVICE rental modular wall containment solution!We are dedicated to creating a safe, budget-friendly, zero-waste, time-saving environment for ALL spaces under construction! We are committed to first-rate installation techniques, building relationships with local construction companies and providing the highest level of customer service!Passive Income: Collect recurring rental fees between installation and disassembly of containment projects, making the investment work for you!Turnkey Solution: Rental, installation and removal for a stress-free and maintenance!Numerous Industries & Applications: Leverage growth in the equipment rental business across the multitude construction and renovations taking place in a wide array of industries!Lower Costs of business!  Home Based or small office!Work-Life Balance: Simple installations providing flexible hours, no time clock required!$35 billion U.S. commercial property remodeling industry!$10 trillion spent on construction-related goods & services, annually!$9 billion spent on hospital and healthcare renovation projects that require proper containment solutions!","Tarrant County, TX",Included in asking price,2,Home Based,Full and ongoing franchisor support and training.,This business is Home-Based,This business is an established franchise
Three Smoke Shops for sale,"Denton, TX (Denton County)","$1,250,000","$400,000","$2,126,163",N/A,2018,"$275,000","$110,000",Three smoke shops running and profitable. the first one opened in 2018 and the second in 2020 and the third in 2022. Short driving distance between all of them located in North Texas in a college town. willing to sell all three of them or as individuals.,"Denton, TX",Included in asking price,Leased,"3,700",N/A,10,Included in asking price
Great Dripping Springs Pool Route,"Dripping Springs, TX (Hays County)","$60,000","$58,650","$69,000",N/A,1998,N/A,N/A,"Here’s your chance to own a great pool route in Dripping Springs, TX! The route consists of 22 residential accounts generating a monthly income of $5,000.00 inclusive of chemicals, plus additional income from repairs and filter cleans! Although this route isn’t advertised as offering owner financing, if you have 60% to put down we can present it to the owner to see if they want to carry the remaining 40%. Serious buyers only.More information:What is a pool route? It’s a group of accounts being sold by a pool company. Typically it’s being sold to fund other ventures or as part of a retirement plan.Why are pool routes better than buying a traditional business? If you compare incomes vs asking prices it’s very clear. A route generating $50,000 per year will sell for roughly $50,000. A traditional business making the same income would cost $100,000 or more to purchase. There are other great benefits as well. Give us a call to learn more.At Sealey Business Brokers we want you to get started off on the right path to success, so we can include our very own Quick Start Program and get 30% off QuickBooks by signing up with Bookkeeping 101! Also included with every route is our free consultation to share our almost 10 years of experience in the swimming pool industry.","Dripping Springs, TX",Unlimited potential to expand,Seller will provide 30 days of training to ensure a smooth transition.,Retirement
Florist & Gift Shop,"Montgomery, TX (Montgomery County)","$425,000","$216,000","$479,571",N/A,1987,"$53,000",N/A,"Family owned since 1987 and in historic downtown Montgomery, TX for 22 years, this business transfers with 13 years of customer history. Primary supplier for large local funeral home. 25 wedding venues within a 15-mile radius. Favorable retail location beginning in March 2023Transferable lease with favorable terms through Jan 14, 2028. Owners have retired out of state. Excellent team in place. Once established in the new location, March 20-May 24, 2023 showing 20% increase YOY from same time period 2022.","Montgomery, TX",Included in asking price,Leased,"1,250",1/14/2028,4,"5 year lease in place in favorable location
Walk in cooler
2 display cooler
Rotating floral inventory
Wedding prop inventory
13 year customer history in POS system","Growing area with on-going residential development. Primary wire services include FTD and Teleflora, accounting for approximately 25% of gross sales.","-Website management
-Social media advertising/marketing
-Wedding business has not been pursued in recent years
-Gift sales have not been pursued in recent years
-Special school events such as prom, homecoming and Cotillion
- Owners are founding members of the Montgomery Area Chamber of Commerce but not involved in recent years. Networking and education opportunities through Chamber and floral industry trade groups. 
-Considered a separate location in 77316","Seller's are willing to finance a small portion of the sales price, 20% or less for a",Negotiable,Retirement,https://www.pecanhillflorist.com
N/A,N/A,N/A,N/A,N/A,N/A,N/A,N/A,N/A,N/A
Turnkey opportunity to enter the supplement industry from home,"Austin, TX (Travis County)","$110,000",N/A,N/A,N/A,2019,N/A,N/A,"I made this product because running in Texas was hot and depleting. It is  based on the nutritional profile of pickle juice. It is similar to Liquid IV, which is very successful on Amazon and within retail stores. It is an improvement over Liquid IV, however, in that it contains a prebiotic for gut health and an amino acid, glutamine, for muscle rebuilding and recovery.  It needs someone with time and energy to do the marketing and it will explode. Make money while relaxing at home. I have gotten into other businesses and have had no time to market this product; hence, the reason I’m selling.","Austin, TX","I have product, packaging for future units, and a system for repeated manufacturing. (Home Based)","Highly competitive electrolyte supplement market. But a very difficult industry to get a product manufactured and launched. The buyer is being handed a product and an ""in"" into a highly competitive market with many barriers to entry.","I made this product but became involved in other businesses. It's had slow, organic growth but almost no active advertising. It sells on Amazon and in two Texas retail stores. If someone has the time this product can explode in revenue.",I can remain involved for two months to educate you about the process and establish necessary business contacts.,I have no time due to other business commitments.,This business is Home-Based
Established American Cuisine  Restaurant.,"Dallas, TX (Dallas County)","$2,700,000",N/A,"$3,000,000",N/A,2020,N/A,N/A,Established Brunch Restaurant  and Thriving High-End High Volume Restaurant.  -     Prime Location- One of The Fast Growing Areas-	High Income  High Volume.-      Great Customers.,"Dallas, TX",Leased,"3,700",N/A,18,Upscale,Keep Growing.,Nego
"Leading provider of youth athletic activities, camps, leagues, etc","Frisco, TX (Denton County)","$60,000",N/A,"$42,378",N/A,2021,"$5,000*","$1,000","OTA combines quality curriculum and incredible teachers to provide stress-free sports programs and activities to schools, community associations, leagues facilities, organizations, and recreation departments.","Frisco, TX",Not included in asking price,2,Included in asking price,All of the sports equipment bags and marketing materials are available. (Home Based),"DFW is a MASSIVE market for youth sports programing. 

Competition is limited to a few key players. 

Having DFW as a territory separates you from the competition.","My partner and I had full time jobs and were unable to put the time in that was required to grow this business.

The growth potential is unlimited for the right person. 

We have several opportunities that just need to be followed up with that could double the revenue easily.","My partner and I will provide training along with the support of the franchise. 

We will make introductions to all of the current clients and prospective clients.",We do not have time to properly run this business with full time careers.,This business is Home-Based,This business is an established franchise,https://www.otathletics.com/dfw
Very Unique and Profitable Roll Off Dumpster Company for Sale,"Montgomery County, TX","$720,000",N/A,N/A,N/A,2020,"$690,000",N/A,Unique dumpster company that offers roll off dumpsters that have two toilets built into the dumpster and we also offer standard roll off dumpsters. We have 6 protected territories that have a population of over 1.2 million people. Contractors and homeowners love the dumpster and toilet combos because they will not flip over in high winds creating a mess on their driveway and property. Since starting 3 years ago the business has grown year over year and we are having our best year yet.,"Montgomery County, TX",Included in asking price,Leased,N/A,6/30/2024,2,We currently lease two acres to store the euipment. (Home Based),Market has been strong especially with more people staying in their current homes and remodeling to better fit their needs. The competition here is really not too strong there are some large companies but once customers work with us and understand we care about them and we can offer them two services in one it really makes a huge difference.,With us having the northern territories there is room to grow up north. The plan is with the growth we are experiencing to purchase a second truck and hire another driver to be able to have more drops and pickups in a month to increase the sales. We are seeing sales increase with customers referring us out to other people and businesses. Word of mouth is really pushing sales at this time. Customers are not used to be treated good by a dumpster company.,The training from the franchise is awesome and very detailed. We would stay on for at least 3 months to help transition someone. We have great support from the Redbox Plus Dumpster corporate team. There is also a forum that all the owners are on to knock around ideas and help each other out. Belfor does a great job with training.,Not long after purchasing this franchise I have had some health issues that slow,This business is Home-Based,This business is an established franchise,http://www.redboxplus.com/north-houston/
Whistling Duck Vineyard & Winery For Sale,"Weimar, TX (Colorado County)","$2,450,000",N/A,"$506,000",N/A,2007,N/A,"$71,000","Quiet country property with business that has untapped potential!! Located 1 hour from the booming town of Katy and the ever expanding Houston metro area, this off-the-path tasting room and vineyard gives you the feel that you have stepped out of the hustle and bustle of the city life and you’ve slowed down to an enjoyable country pace not far from the comforts of town. The 14.5 acre property sits on flat land that has been cared for by the seller and grown to a beautiful vineyard and expanded tasting room.","Weimar, TX",Owned,"5,800",12,Included in asking price,"Multiple buildings
Tasting Room
Tasting Room
Storage
House 2200sf with pool",Tremendous growth and expansion on the venue side of the business. There is limited weddings done onsite and the house could be used as a B&B. Corporate retreats are good options as well. Craft Brew pub or distillery could be housed in the smaller tasting room.,Owners have grown the business as best as they feel they can and want to hand it
Rapidly Growing Electrical Company for Sale,"Fort Worth, TX (Tarrant County)","$1,850,000","$668,562","$3,296,226","$772,539",2014,"$15,000",N/A,"Throughout its operational history, the business has steadily grown and established itself as a reputable player in its industry. With a solid foundation and a track record of success, it has built a loyal customer base and developed key relationships with suppliers and partners.Under the guidance of its experienced management team, the business has demonstrated a commitment to delivering high-quality products/services and maintaining customer satisfaction. It has successfully navigated market challenges and adapted to changing industry trends, showcasing its resilience and adaptability.","Fort Worth, TX",Included in asking price,Leased,N/A,N/A,22,"The location is currently leased at a monthly rent of $6,000. The remaining time on the lease is negotiable, providing flexibility for potential buyers to secure suitable lease terms that align with their business plans. The property encompasses two buildings and a parking lot, providing ample space for the business's operations and potential future expansion.",n/a,"The business currently utilizes minimal marketing channels, presenting an opportunity to invest more in marketing efforts. By expanding the marketing strategy, reaching a broader audience, and implementing effective marketing campaigns, the business can increase brand awareness, attract new customers, and generate more leads.",The current owner is willing to negotiate the terms of the transaction.,The owner is willing to stay on for up to one year to help with the transition.,The owner is looking to retire.,https://viabeacon.com/listing/rapidly-growing-electrical-company
